{
  "id": "f47ac10b-58cc-4372-a567-0e02b2c3d479",
  "definitionUrl": "https://example.gov/forms/grant-application",
  "definitionVersion": "1.0.0",
  "status": "in-progress",
  "authored": "2026-02-28T16:45:00.000Z",
  "author": {
    "id": "user-001",
    "name": "Jane Smith"
  },
  "subject": {
    "id": "GRANT-2026-001",
    "type": "grant-application"
  },
  "validationResults": [
    {
      "path": "budget.lineItems[2].quantity",
      "severity": "error",
      "constraintKind": "type",
      "message": "Quantity must be an integer value.",
      "code": "TYPE_MISMATCH",
      "source": "bind",
      "sourceId": "budget.lineItems[*].quantity",
      "value": "two"
    },
    {
      "path": "applicantInfo.ein",
      "severity": "warning",
      "constraintKind": "external",
      "message": "EIN status could not be confirmed by the IRS lookup service. Re-check before final submit.",
      "code": "EIN_LOOKUP_PENDING",
      "source": "external",
      "sourceId": "x-irs-ein-lookup",
      "value": "47-1234567",
      "context": {
        "endpoint": "https://api.irs.gov/ein-lookup",
        "checkedAt": "2026-02-28T16:40:00.000Z",
        "transactionId": "irs-lookup-20260228-0042"
      },
      "extensions": {
        "x-reviewAction": "retry-before-complete"
      }
    }
  ],
  "extensions": {
    "x-amendment": {
      "amendedFromResponseId": "f47ac10b-58cc-4372-a567-0e02b2c3d479",
      "reason": "Budget correction after reviewer feedback",
      "reopenedBy": "reviewer-17"
    }
  },
  "data": {
    "applicantInfo": {
      "orgName": "Community Health Partners, Inc.",
      "ein": "47-1234567",
      "orgType": "nonprofit",
      "projectWebsite": "https://chp.example.org/telehealth",
      "contactName": "Jane Smith",
      "contactEmail": "jane.smith@chp.example.org",
      "contactPhone": "(202) 555-0142"
    },
    "projectNarrative": {
      "projectTitle": "Rural Telehealth Access Initiative (Amended)",
      "abstract": "Amended submission includes corrected staffing assumptions and an added outreach pilot in County 4.",
      "submissionDeadline": "2026-06-30T17:00:00",
      "meetingTime": "14:30",
      "startDate": "2026-09-01",
      "endDate": "2027-08-31",
      "duration": 12,
      "indirectRate": 20,
      "focusAreas": ["health", "equity"],
      "selfAssessment": 4
    },
    "budget": {
      "lineItems": [
        {
          "category": "personnel",
          "description": "Program Director (0.5 FTE) + Care Coordinator (1.5 FTE)",
          "quantity": 2,
          "unitCost": { "amount": "50000.00", "currency": "USD" },
          "subtotal": { "amount": "100000.00", "currency": "USD" }
        },
        {
          "category": "travel",
          "description": "Site visits and stakeholder meetings",
          "quantity": 1,
          "unitCost": { "amount": "5000.00", "currency": "USD" },
          "subtotal": { "amount": "5000.00", "currency": "USD" }
        },
        {
          "category": "equipment",
          "description": "Telehealth starter kits for rural clinics",
          "quantity": "two",
          "unitCost": { "amount": "15600.00", "currency": "USD" },
          "subtotal": { "amount": "31200.00", "currency": "USD" }
        }
      ],
      "requestedAmount": { "amount": "136200.00", "currency": "USD" },
      "usesSubcontractors": true
    },
    "attachments": {
      "narrativeDoc": {
        "filename": "narrative-telehealth-2026-amended.pdf",
        "contentType": "application/pdf",
        "size": 2621440
      },
      "budgetJustification": {
        "filename": "budget-detail-2026-amended.xlsx",
        "contentType": "application/vnd.openxmlformats-officedocument.spreadsheetml.sheet",
        "size": 168400
      }
    }
  }
}
