{
  "definitionUrl": "https://formspec.org/examples/invoice",
  "definitionVersion": "1.0.0",
  "status": "completed",
  "authored": "2026-03-04T12:10:00Z",
  "data": {
    "header": {
      "invoiceNumber": "INV-2026-0001",
      "invoiceDate": "2026-03-04",
      "dueDate": "2026-04-03",
      "customerName": "Acme Corp",
      "customerEmail": "ap@acme.example"
    },
    "lineItems": [
      {
        "itemDescription": "Consulting services",
        "quantity": 2,
        "unitPrice": { "amount": "150.00", "currency": "USD" },
        "lineTotal": { "amount": "300.00", "currency": "USD" }
      }
    ],
    "totals": {
      "subtotal": { "amount": "300.00", "currency": "USD" },
      "taxRate": 0,
      "taxAmount": { "amount": "0.00", "currency": "USD" },
      "discountPercent": 0,
      "discountAmount": { "amount": "0.00", "currency": "USD" },
      "grandTotal": { "amount": "300.00", "currency": "USD" }
    },
    "notes": "Thank you for your business."
  }
}
