{
    "definitionUrl": "https://formspec.org/examples/clinical-intake",
    "definitionVersion": "1.0.0",
    "status": "in-progress",
    "authored": "2026-03-04T13:00:00Z",
    "data": {
        "patient": {
            "firstName": "Robert",
            "lastName": "Chen",
            "dob": "1962-05-15",
            "insuranceId": "INS-9988776"
        },
        "currentVisit": {
            "appointmentDate": "2026-03-04",
            "symptoms": ["chest_pain", "shortness_of_breath"],
            "onsetDate": "2026-03-04"
        },
        "medicalHistory": {
            "hasAllergies": false,
            "conditions": []
        }
    }
}
