{
  "definitionUrl": "https://formspec.org/examples/clinical-intake",
  "definitionVersion": "1.0.0",
  "status": "in-progress",
  "authored": "2026-03-04T13:30:00Z",
  "data": {
    "patient": {
      "firstName": "Jamie",
      "lastName": "Rivera",
      "dob": "1980-05-14",
      "age": 45,
      "sex": "female",
      "phone": "(202) 555-0199",
      "email": "jamie.rivera@example.test",
      "insuranceMemberId": "ABC1234567",
      "insuranceCard": null
    },
    "currentVisit": {
      "symptoms": ["headache", "pain"],
      "otherSymptoms": null,
      "onsetDate": "2026-03-03",
      "onsetTime": "10:00",
      "appointmentDateTime": "2026-03-05T11:00:00Z",
      "provider": "family"
    },
    "medicalHistory": {
      "hasAllergies": false,
      "allergies": null,
      "conditions": [
        {
          "conditionName": "Diabetes",
          "diagnosedDate": "2015-02-01",
          "severity": "severe",
          "condMedCount": 1,
          "condWorsening": null,
          "medications": [
            {
              "medDrugName": "Metformin",
              "medDosage": "500mg",
              "medFrequency": "bid",
              "medStartDate": "2015-03-01"
            }
          ]
        },
        {
          "conditionName": "Hyperlipidemia",
          "diagnosedDate": "2018-09-10",
          "severity": "moderate",
          "condMedCount": 1,
          "condWorsening": null,
          "medications": [
            {
              "medDrugName": "Atorvastatin",
              "medDosage": "20mg",
              "medFrequency": "daily",
              "medStartDate": "2018-10-01"
            }
          ]
        }
      ]
    },
    "assessment": {
      "totalConditions": 2,
      "severeConditionCount": 1,
      "totalMedications": 2,
      "symptomDuration": 1,
      "maskedInsuranceId": "****4567"
    }
  }
}
