{
  "definitionUrl": "https://formspec.org/examples/clinical-intake",
  "definitionVersion": "1.0.0",
  "status": "completed",
  "authored": "2026-03-04T13:20:00Z",
  "data": {
    "patient": {
      "firstName": "Jamie",
      "lastName": "Rivera",
      "dob": "1980-05-14",
      "age": 45,
      "sex": "female",
      "phone": "(202) 555-0199",
      "email": "jamie.rivera@example.test",
      "insuranceMemberId": "ABC1234567",
      "insuranceCard": null
    },
    "currentVisit": {
      "symptoms": ["fatigue"],
      "otherSymptoms": null,
      "onsetDate": "2026-02-28",
      "onsetTime": "14:15",
      "appointmentDateTime": "2026-03-05T15:00:00Z",
      "provider": "internal"
    },
    "medicalHistory": {
      "hasAllergies": false,
      "allergies": null,
      "conditions": [
        {
          "conditionName": "Hypertension",
          "diagnosedDate": "2019-06-15",
          "severity": "moderate",
          "condMedCount": 2,
          "condWorsening": null,
          "medications": [
            {
              "medDrugName": "Lisinopril",
              "medDosage": "10mg",
              "medFrequency": "daily",
              "medStartDate": "2020-01-10"
            },
            {
              "medDrugName": "Amlodipine",
              "medDosage": "5mg",
              "medFrequency": "daily",
              "medStartDate": "2021-03-22"
            }
          ]
        }
      ]
    },
    "assessment": {
      "totalConditions": 1,
      "severeConditionCount": 0,
      "totalMedications": 2,
      "symptomDuration": 5,
      "maskedInsuranceId": "****4567"
    }
  }
}
