{
  "definitionUrl": "https://formspec.org/examples/clinical-intake",
  "definitionVersion": "1.0.0",
  "status": "in-progress",
  "authored": "2026-03-04T13:10:00Z",
  "data": {
    "patient": {
      "firstName": "Jamie",
      "lastName": "Rivera",
      "dob": "1980-05-14",
      "age": 45,
      "sex": "female",
      "phone": "(202) 555-0199",
      "email": "jamie.rivera@example.test",
      "insuranceMemberId": "ABC1234567",
      "insuranceCard": null
    },
    "currentVisit": {
      "symptoms": ["other", "cough"],
      "otherSymptoms": "Sore throat and mild congestion",
      "onsetDate": "2026-03-01",
      "onsetTime": "08:00",
      "appointmentDateTime": "2026-03-06T09:30:00Z",
      "provider": "any"
    },
    "medicalHistory": {
      "hasAllergies": true,
      "allergies": null,
      "conditions": []
    },
    "assessment": {
      "totalConditions": 0,
      "severeConditionCount": 0,
      "totalMedications": 0,
      "symptomDuration": 3,
      "maskedInsuranceId": "****4567"
    }
  }
}
