{
    "definitionUrl": "https://acf.hhs.gov/formspec/csbg/tribal-long",
    "definitionVersion": "3.0.4",
    "status": "in-progress",
    "authored": "2026-03-04T15:30:00Z",
    "data": {
        "basicInfo": {
            "orgName": "Mashpee Wampanoag Tribe",
            "contactName": "Jane Doe",
            "contactTitle": "CSBG Program Director",
            "phone": "(508) 477-0208",
            "email": "jdoe@mashpeewampanoag.gov"
        },
        "applicableTopics": [
            "employment",
            "housing",
            "health"
        ],
        "expenditures": {
            "employment": {
                "amount": "45000.00",
                "currency": "USD"
            },
            "childcare": {
                "amount": "0.00",
                "currency": "USD"
            },
            "assetBuilding": {
                "amount": "0.00",
                "currency": "USD"
            },
            "housing": {
                "amount": "32000.00",
                "currency": "USD"
            },
            "health": {
                "amount": "28000.00",
                "currency": "USD"
            },
            "civic": {
                "amount": "0.00",
                "currency": "USD"
            },
            "transportation": {
                "amount": "0.00",
                "currency": "USD"
            },
            "partnerships": {
                "amount": "0.00",
                "currency": "USD"
            },
            "other": {
                "amount": "0.00",
                "currency": "USD"
            },
            "total": {
                "amount": "105000.00",
                "currency": "USD"
            }
        },
        "hasAdministrationCosts": true,
        "administrationExpenditure": {
            "amount": "8500.00",
            "currency": "USD"
        },
        "descriptions": {
            "employmentDesc": "Provided job placement assistance for 42 tribal members through partnerships with local employers.",
            "educationDesc": "N/A",
            "incomeDesc": "N/A",
            "housingDesc": "Completed emergency housing repairs and weatherization for 15 tribally-owned homes.",
            "healthDesc": "Operated mobile health clinic serving 280 individuals across three communities twice monthly.",
            "civicDesc": "N/A",
            "transportationDesc": "N/A",
            "partnershipsDesc": "N/A",
            "otherDesc": "N/A"
        },
        "demographics": {
            "totalServed": null,
            "totalServedOver18": null,
            "sexBreakdown": {
                "male": null,
                "female": null,
                "sexTotal": null
            },
            "employmentStatus": {
                "fullTime": null,
                "partTime": null,
                "migrantSeasonal": null,
                "unemployedShort": null,
                "unemployedLong": null,
                "notInLaborForce": null,
                "retired": null,
                "unknown": null,
                "employmentTotal": null
            }
        }
    }
}
