{
    "definitionUrl": "https://acf.hhs.gov/formspec/csbg/tribal-short",
    "definitionVersion": "3.0.0",
    "status": "in-progress",
    "authored": "2026-03-04T13:00:00Z",
    "data": {
        "basicInfo": {
            "orgName": "Mashpee Wampanoag Tribe",
            "contactName": "Jane Doe",
            "contactTitle": "CSBG Program Director",
            "phone": "(508) 477-0208",
            "email": "jdoe@mashpeewampanoag.gov"
        },
        "applicableTopics": [
            "employment",
            "housing"
        ],
        "expenditures": {
            "employment": {
                "amount": "45000.00",
                "currency": "USD"
            },
            "childcare": {
                "amount": "0.00",
                "currency": "USD"
            },
            "assetBuilding": {
                "amount": "0.00",
                "currency": "USD"
            },
            "housing": null,
            "health": {
                "amount": "0.00",
                "currency": "USD"
            },
            "civic": {
                "amount": "0.00",
                "currency": "USD"
            },
            "transportation": {
                "amount": "0.00",
                "currency": "USD"
            },
            "partnerships": {
                "amount": "0.00",
                "currency": "USD"
            },
            "other": {
                "amount": "0.00",
                "currency": "USD"
            },
            "total": {
                "amount": "45000.00",
                "currency": "USD"
            }
        },
        "hasAdministrationCosts": null,
        "administrationExpenditure": null,
        "descriptions": {
            "employmentDesc": "Job placement assistance and vocational training for 42 tribal members.",
            "educationDesc": "N/A",
            "incomeDesc": "N/A",
            "housingDesc": null,
            "healthDesc": "N/A",
            "civicDesc": "N/A",
            "transportationDesc": "N/A"
        }
    }
}
