{
  "definitionUrl": "https://formspec.org/examples/invoice",
  "definitionVersion": "1.0.0",
  "status": "in-progress",
  "authored": "2026-03-04T12:30:00Z",
  "data": {
    "header": {
      "invoiceNumber": "INV-2026-0003",
      "invoiceDate": "2026-03-04",
      "dueDate": "2026-04-03",
      "customerName": "Example Customer",
      "customerEmail": "customer@example.invalid"
    },
    "lineItems": [
      {
        "itemDescription": "Incomplete line item",
        "quantity": null,
        "unitPrice": { "amount": "10.00", "currency": "USD" },
        "lineTotal": null
      }
    ],
    "totals": {
      "subtotal": { "amount": "0.00", "currency": "USD" },
      "taxRate": 0,
      "taxAmount": { "amount": "0.00", "currency": "USD" },
      "discountPercent": 0,
      "discountAmount": { "amount": "0.00", "currency": "USD" },
      "grandTotal": { "amount": "0.00", "currency": "USD" }
    },
    "notes": null
  }
}
